{
  "case_id": "case_06",
  "adjudications": [
    {
      "candidate_index": 0,
      "outcome": "admit",
      "reason": "supported_material_finding",
      "evidence_summary": "The implementation catches Exception around every invocation and retries without classifying the failure. The reported probe confirms that a deterministic ValueError is invoked once per configured attempt before being re-raised.",
      "scope_assessment": "This behavior is intrinsic to the supplied retry helper for any operation that raises an Exception; it does not depend on an unsupported caller or infrastructure assumption.",
      "materiality_assessment": "Retrying deterministic failures can repeat operation work or partial side effects and therefore poses a material correctness and reliability risk."
    },
    {
      "candidate_index": 1,
      "outcome": "admit",
      "reason": "supported_material_finding",
      "evidence_summary": "After catching an exception, the loop immediately invokes the operation again. There is no delay, backoff, jitter, or retry-delay signal, and the reported timing probe confirms hot-loop retries.",
      "scope_assessment": "Immediate retry is the supplied helper's unconditional behavior for failed attempts and applies directly to its normal transient-failure use case.",
      "materiality_assessment": "During dependency degradation, immediate retries can amplify load and synchronize pressure from concurrent callers, creating a material reliability and operational-performance risk."
    },
    {
      "candidate_index": 2,
      "outcome": "reject",
      "reason": "not_material",
      "evidence_summary": "The implementation does produce AssertionError for non-positive attempts and an optimization-dependent TypeError when assertions are disabled, as claimed.",
      "scope_assessment": "The behavior is reachable through the public integer parameter, but only when the caller supplies a non-positive retry count, which is not a meaningful retry operation and is outside the helper's demonstrated usage.",
      "materiality_assessment": "The result is an immediate, visible caller error without operation execution or silent data corruption. Stable argument validation would improve the API, but the candidate does not establish a material production-readiness failure."
    }
  ],
  "merge_groups": [],
  "final_review": {
    "case_id": "case_06",
    "decision": "not_ready",
    "findings": [
      {
        "category": "retry_policy",
        "severity": "high",
        "claim": "The helper retries every Exception without distinguishing transient failures from deterministic or non-retryable failures, so failed operations can be executed repeatedly even when another attempt cannot succeed.",
        "evidence": [
          "evals/cases/case_06/src/retry.py:7-11 catches the undifferentiated Exception base class and continues the retry loop without a retryability predicate or exception allowlist.",
          "A runtime probe using an operation that always raises ValueError('invalid payload') showed that call_with_retry(..., attempts=3) invoked the operation three times before re-raising ValueError."
        ],
        "verified": true,
        "confidence": 0.99
      },
      {
        "category": "retry_policy",
        "severity": "high",
        "claim": "Retries run immediately with no delay, backoff, or jitter, which can amplify load against a failing dependency and make concurrent callers retry in lockstep during an outage.",
        "evidence": [
          "evals/cases/case_06/src/retry.py:7-11 immediately begins the next loop iteration after an exception; there is no sleep, backoff calculation, jitter, or server-directed delay handling.",
          "A runtime probe with three consecutive TimeoutError failures recorded only 2.515 and 1.332 microseconds between invocation timestamps, confirming that the attempts are issued as a hot loop."
        ],
        "verified": true,
        "confidence": 0.99
      }
    ],
    "uncertainties": [
      "The case does not document which exception types are intended to be retryable or whether callers guarantee that operations are idempotent.",
      "The case does not define an expected backoff schedule or maximum elapsed retry duration."
    ]
  }
}
